{
  "task_id": "phase3-local-smoke",
  "status": "PASS",
  "attempts": 1,
  "started_at": "2026-05-16T08:54:02+00:00",
  "finished_at": "2026-05-16T08:54:02+00:00",
  "workspace": "C:\\Users\\minho\\Documents\\02_work\\03_AI\\05_true atonomous_controller",
  "summary": "[PASS] phase3-local-smoke phase=3 reason=all commands completed within local scaffold bounds",
  "commands": [
    {
      "id": "dry-run-echo",
      "argv": [
        "echo",
        "phase3 dry run ok"
      ],
      "exit_code": 0,
      "duration_sec": 0.0,
      "stdout_tail": "DRY_RUN would execute: echo phase3 dry run ok",
      "stderr_tail": ""
    }
  ],
  "review": {
    "status": "PASS",
    "reasons": [
      "all commands completed within local scaffold bounds"
    ],
    "retry_allowed": false,
    "escalation_required": false
  }
}
